[
  {
    "name": "Rage",
    "class_name": "Barbarian",
    "level": 1,
    "description": "You can imbue yourself with a primal power called Rage, a force that grants you extraordinary might and resilience. You can enter it as a Bonus Action if you aren't wearing Heavy armor.\n\nWhile active, your Rage follows the rules below:\n\nDamage Resistance: You have Resistance to Bludgeoning, Piercing, and Slashing damage.\n\nRage Damage: When you make an attack using Strength—with either a weapon or an Unarmed Strike—and deal damage to the target, you gain a bonus to the damage that increases as you gain levels as a Barbarian, as shown in the Rage Damage column of the Barbarian Features table.\n\nStrength Advantage: You have Advantage on Strength checks and Strength saving throws.\n\nNo Concentration or Spells: You can't maintain Concentration, and you can't cast spells.\n\nDuration: The Rage lasts until the end of your next turn, and it ends early if you don Heavy armor or have the Incapacitated condition. If your Rage is still active on your next turn, you can extend the Rage for another round by doing one of the following: Make an attack roll against an enemy, Force an enemy to make a saving throw, or Take a Bonus Action to extend your Rage. Each time the Rage is extended, it lasts until the end of your next turn. You can maintain a Rage for up to 10 minutes.",
    "mechanical_effect": {
      "type": "rage",
      "uses": 2,
      "recharge_on": "short_rest"
    }
  },
  {
    "name": "Unarmored Defense",
    "class_name": "Barbarian",
    "level": 1,
    "description": "While you aren't wearing any armor, your base Armor Class equals 10 plus your Dexterity and Constitution modifiers. You can use a Shield and still gain this benefit.",
    "mechanical_effect": {
      "type": "ac_bonus",
      "notes": "AC = 10 + DEX modifier + CON modifier"
    }
  },
  {
    "name": "Weapon Mastery",
    "class_name": "Barbarian",
    "level": 1,
    "description": "Your training with weapons allows you to use the mastery properties of two kinds of Simple or Martial Melee weapons of your choice, such as Greataxes and Handaxes. Whenever you finish a Long Rest, you can practice weapon drills and change one of those weapon choices.\n\nWhen you reach certain Barbarian levels, you gain the ability to use the mastery properties of more kinds of weapons, as shown in the Weapon Mastery column of the Barbarian Features table.",
    "mechanical_effect": {
      "type": "weapon_mastery",
      "uses": 2,
      "recharge_on": "long_rest"
    }
  },
  {
    "name": "Danger Sense",
    "class_name": "Barbarian",
    "level": 2,
    "description": "You gain an uncanny sense of when things aren't as they should be, giving you an edge when you dodge perils. You have Advantage on Dexterity saving throws unless you have the Incapacitated condition.",
    "mechanical_effect": {
      "type": "saving_throw_advantage",
      "notes": "Advantage on Dexterity saving throws"
    }
  },
  {
    "name": "Reckless Attack",
    "class_name": "Barbarian",
    "level": 2,
    "description": "You can throw aside all concern for defense to attack with increased ferocity. When you make your first attack roll on your turn, you can decide to attack recklessly. Doing so gives you Advantage on attack rolls using Strength until the start of your next turn, but attack rolls against you have Advantage during that time.",
    "mechanical_effect": {
      "type": "attack_advantage",
      "notes": "Advantage on Strength attack rolls, but enemies also have Advantage to attack you"
    }
  },
  {
    "name": "Barbarian Subclass",
    "class_name": "Barbarian",
    "level": 3,
    "description": "You gain a Barbarian subclass of your choice. The Path of the Berserker subclass is detailed after this class's description. A subclass is a specialization that grants you features at certain Barbarian levels. For the rest of your career, you gain each of your subclass's features that are of your Barbarian level or lower."
  },
  {
    "name": "Primal Knowledge",
    "class_name": "Barbarian",
    "level": 3,
    "description": "You gain proficiency in another skill of your choice from the skill list available to Barbarians at level 1.\n\nIn addition, while your Rage is active, you can channel primal power when you attempt certain tasks; whenever you make an ability check using one of the following skills, you can make it as a Strength check even if it normally uses a different ability: Acrobatics, Intimidation, Perception, Stealth, or Survival. When you use this ability, your Strength represents primal power coursing through you, honing your agility, bearing, and senses."
  },
  {
    "name": "Ability Score Improvement",
    "class_name": "Barbarian",
    "level": 4,
    "description": "You gain the Ability Score Improvement feat (see \"Feats\") or another feat of your choice for which you qualify. You gain this feature again at Barbarian levels 8, 12, and 16."
  },
  {
    "name": "Extra Attack",
    "class_name": "Barbarian",
    "level": 5,
    "description": "You can attack twice instead of once whenever you take the Attack action on your turn.",
    "mechanical_effect": {
      "type": "extra_attack",
      "value": 2
    }
  },
  {
    "name": "Fast Movement",
    "class_name": "Barbarian",
    "level": 5,
    "description": "Your speed increases by 10 feet while you aren't wearing Heavy armor.",
    "mechanical_effect": {
      "type": "movement_bonus",
      "value": 10
    }
  },
  {
    "name": "Feral Instinct",
    "class_name": "Barbarian",
    "level": 7,
    "description": "Your instincts are so honed that you have Advantage on Initiative rolls.",
    "mechanical_effect": {
      "type": "initiative_advantage"
    }
  },
  {
    "name": "Instinctive Pounce",
    "class_name": "Barbarian",
    "level": 7,
    "description": "As part of the Bonus Action you take to enter your Rage, you can move up to half your Speed.",
    "mechanical_effect": {
      "type": "movement_bonus",
      "notes": "Move up to half your Speed as part of Rage Bonus Action"
    }
  },
  {
    "name": "Brutal Strike",
    "class_name": "Barbarian",
    "level": 9,
    "description": "If you use Reckless Attack, you can forgo any Advantage on one Strength-based attack roll of your choice on your turn. The chosen attack roll mustn't have Disadvantage. If the chosen attack roll hits, the target takes an extra 1d10 damage of the same type dealt by the weapon or Unarmed Strike, and you can cause one Brutal Strike effect of your choice.\n\nForceful Blow: The target is pushed 15 feet straight away from you. You can then move up to half your Speed straight toward the target without provoking Opportunity Attacks.\n\nHamstring Blow: The target's Speed is reduced by 15 feet until the start of your next turn. A target can be affected by only one Hamstring Blow at a time—the most recent one.",
    "mechanical_effect": {
      "type": "extra_damage",
      "value": "1d10"
    }
  },
  {
    "name": "Relentless Rage",
    "class_name": "Barbarian",
    "level": 11,
    "description": "Your Rage can keep you fighting despite grievous wounds. If you drop to 0 Hit Points while your Rage is active and don't die outright, you can make a DC 10 Constitution saving throw. If you succeed, your Hit Points instead change to a number equal to twice your Barbarian level.\n\nEach time you use this feature after the first, the DC increases by 5. When you finish a Short or Long Rest, the DC resets to 10."
  },
  {
    "name": "Improved Brutal Strike",
    "class_name": "Barbarian",
    "level": 13,
    "description": "You have honed new ways to attack furiously. The following effects are now among your Brutal Strike options.\n\nStaggering Blow: The target has Disadvantage on the next saving throw it makes, and it can't make Opportunity Attacks until the start of your next turn.\n\nSundering Blow: Before the start of your next turn, the next attack roll made by another creature against the target gains a +5 bonus to the roll. An attack roll can gain only one Sundering Blow bonus."
  },
  {
    "name": "Persistent Rage",
    "class_name": "Barbarian",
    "level": 15,
    "description": "When you roll Initiative, you can regain all expended uses of Rage. After you regain uses of Rage in this way, you can't do so again until you finish a Long Rest.\n\nIn addition, your Rage is so fierce that it now lasts for 10 minutes without you needing to do anything to extend it from round to round. Your Rage ends early if you have the Unconscious condition (not just the Incapacitated condition) or don Heavy armor."
  },
  {
    "name": "Improved Brutal Strike",
    "class_name": "Barbarian",
    "level": 17,
    "description": "The extra damage of your Brutal Strike increases to 2d10. In addition, you can use two different Brutal Strike effects whenever you use your Brutal Strike feature.",
    "mechanical_effect": {
      "type": "extra_damage",
      "value": "2d10"
    }
  },
  {
    "name": "Indomitable Might",
    "class_name": "Barbarian",
    "level": 18,
    "description": "If your total for a Strength check or Strength saving throw is less than your Strength score, you can use that score in place of the total.",
    "mechanical_effect": {
      "type": "ability_check_bonus"
    }
  },
  {
    "name": "Epic Boon",
    "class_name": "Barbarian",
    "level": 19,
    "description": "You gain an Epic Boon feat (see \"Feats\") or another feat of your choice for which you qualify. Boon of Irresistible Offense is recommended."
  },
  {
    "name": "Primal Champion",
    "class_name": "Barbarian",
    "level": 20,
    "description": "You embody primal power. Your Strength and Constitution scores increase by 4, to a maximum of 25.",
    "mechanical_effect": {
      "type": "ability_score_increase",
      "value": 4,
      "notes": "STR and CON increase by 4, maximum 25"
    }
  },
  {
    "name": "Frenzy",
    "class_name": "Barbarian",